{
  "$schema": "https://json-schema.org/draft/2020-12/schema",
  "$id": "https://mlain.local/schema/outbox.schema.json",
  "type": "object",
  "additionalProperties": false,
  "required": ["contractVersion", "scenarios", "transitions"],
  "properties": {
    "contractVersion": { "const": 1 },
    "note": { "type": "string" },
    "transitions": {
      "type": "array",
      "minItems": 14,
      "items": {
        "type": "object",
        "additionalProperties": false,
        "required": ["id", "from", "to", "actor", "allowed"],
        "properties": {
          "id": { "type": "string", "pattern": "^TR-[0-9]{3}$" },
          "from": { "$ref": "#/$defs/status" },
          "to": { "$ref": "#/$defs/status" },
          "actor": { "enum": ["app", "sender", "reaper"] },
          "error_code": { "type": ["string", "null"] },
          "allowed": { "type": "boolean" }
        }
      }
    },
    "scenarios": {
      "type": "array",
      "minItems": 23,
      "items": {
        "type": "object",
        "additionalProperties": false,
        "required": ["id", "runner", "title", "expected"],
        "properties": {
          "id": { "type": "string", "pattern": "^OB-[0-9]{2}$" },
          "runner": { "enum": ["contracts", "sender", "campaigns"] },
          "title": { "type": "string", "minLength": 1 },
          "expected": { "type": "string", "minLength": 1 },
          "order": { "type": "integer" }
        }
      }
    }
  },
  "$defs": {
    "status": { "enum": ["pending", "claimed", "sent", "failed", "skipped"] }
  }
}
